{
 "schema": "muffinaudit.suite/1",
 "suite": "black-surface",
 "title": "Black-surface regression",
 "order": 10,
 "description": "The first suite: render-target copies at varied sizes and mips, texture uploads across formats, render-to-texture feedback, texture creation and eviction under pressure, flicker over many frames, clears, blending and depth tests, an audio tone sweep and an input echo. Built to catch black frames and black surfaces, and everything that looks like them.",
 "tests": [
  {
   "id": "bs.orientation",
   "title": "Screen orientation and corner markers",
   "subsystems": [
    "render.present",
    "render.compositing"
   ],
   "kind": "guest",
   "guest": {
    "test": "orientation",
    "params": {
     "hold": "20"
    }
   },
   "estimatedSec": 10,
   "tags": [
    "calibration",
    "quick"
   ],
   "stimulus": "Four small squares, one in each corner of the TV picture (red top right, green bottom left, blue top left, white bottom right) and a grey square in the middle, on a dark background.",
   "expected": "The markers sit where the guest drew them. The app measures which way the picture came out and maps every later expectation through that; a flipped picture is reported here once.",
   "reproduce": "In any Wii U emulator, run audit.rpx and compare the four corner markers with the list above.",
   "checkpoints": [
    {
     "name": "markers",
     "capture": {
      "views": [
       "tv"
      ],
      "count": 1
     },
     "expect": [
      {
       "type": "orientation",
       "name": "orientation"
      },
      {
       "type": "not_black",
       "name": "frame not black",
       "maxBlackFraction": 0.97
      }
     ]
    }
   ],
   "questionnaire": [
    {
     "id": "corners",
     "text": "Is the red square at the top right of the TV picture and the green one at the bottom left?",
     "type": "yesno",
     "bad": "no",
     "severity": "warn",
     "subsystem": "render.present"
    },
    {
     "id": "black",
     "text": "Did you see black spots, black bars or flicker on the picture?",
     "type": "yesno",
     "bad": "yes",
     "subsystem": "render.present"
    }
   ]
  },
  {
   "id": "bs.clear_colours",
   "title": "Clear to seven colours",
   "subsystems": [
    "render.clear",
    "render.colour"
   ],
   "kind": "guest",
   "guest": {
    "test": "clear_colours",
    "params": {
     "hold": "20"
    }
   },
   "estimatedSec": 15,
   "tags": [
    "quick"
   ],
   "stimulus": "The whole picture is cleared to red, green, blue, white, black, mid grey and a steel blue, one after another, about half a second each.",
   "expected": "Each clear fills the whole TV picture with exactly that colour. Black appears only for the black step.",
   "reproduce": "Run audit.rpx; the first test after the orientation markers is this sequence.",
   "checkpoints": [
    {
     "name": "clear_0",
     "capture": {
      "views": [
       "tv"
      ],
      "count": 1
     },
     "expect": [
      {
       "type": "mean_color",
       "name": "frame is red",
       "rgb": [
        255,
        0,
        0
       ],
       "tol": 6
      },
      {
       "type": "not_black",
       "name": "not black",
       "maxBlackFraction": 0.05
      }
     ]
    },
    {
     "name": "clear_1",
     "capture": {
      "views": [
       "tv"
      ],
      "count": 1
     },
     "expect": [
      {
       "type": "mean_color",
       "name": "frame is green",
       "rgb": [
        0,
        255,
        0
       ],
       "tol": 6
      },
      {
       "type": "not_black",
       "name": "not black",
       "maxBlackFraction": 0.05
      }
     ]
    },
    {
     "name": "clear_2",
     "capture": {
      "views": [
       "tv"
      ],
      "count": 1
     },
     "expect": [
      {
       "type": "mean_color",
       "name": "frame is blue",
       "rgb": [
        0,
        0,
        255
       ],
       "tol": 6
      },
      {
       "type": "not_black",
       "name": "not black",
       "maxBlackFraction": 0.05
      }
     ]
    },
    {
     "name": "clear_3",
     "capture": {
      "views": [
       "tv"
      ],
      "count": 1
     },
     "expect": [
      {
       "type": "mean_color",
       "name": "frame is white",
       "rgb": [
        255,
        255,
        255
       ],
       "tol": 6
      },
      {
       "type": "not_black",
       "name": "not black",
       "maxBlackFraction": 0.05
      }
     ]
    },
    {
     "name": "clear_4",
     "capture": {
      "views": [
       "tv"
      ],
      "count": 1
     },
     "expect": [
      {
       "type": "mean_color",
       "name": "frame is black",
       "rgb": [
        0,
        0,
        0
       ],
       "tol": 6
      }
     ]
    },
    {
     "name": "clear_5",
     "capture": {
      "views": [
       "tv"
      ],
      "count": 1
     },
     "expect": [
      {
       "type": "mean_color",
       "name": "frame is grey",
       "rgb": [
        128,
        128,
        128
       ],
       "tol": 6
      },
      {
       "type": "not_black",
       "name": "not black",
       "maxBlackFraction": 0.05
      }
     ]
    },
    {
     "name": "clear_6",
     "capture": {
      "views": [
       "tv"
      ],
      "count": 1
     },
     "expect": [
      {
       "type": "mean_color",
       "name": "frame is steel",
       "rgb": [
        64,
        128,
        191
       ],
       "tol": 6
      },
      {
       "type": "not_black",
       "name": "not black",
       "maxBlackFraction": 0.05
      }
     ]
    }
   ],
   "questionnaire": [
    {
     "id": "black",
     "text": "Did you see black spots, black frames or flicker between the colours?",
     "type": "yesno",
     "bad": "yes",
     "subsystem": "render.clear"
    },
    {
     "id": "colours",
     "text": "Did the colours look correct (red, green, blue, white, black, grey, steel blue)?",
     "type": "yesno",
     "bad": "no",
     "subsystem": "render.colour"
    }
   ]
  },
  {
   "id": "bs.clear_colours_pad",
   "title": "Clear colours on TV and GamePad",
   "subsystems": [
    "render.clear",
    "render.pad"
   ],
   "kind": "guest",
   "guest": {
    "test": "clear_colours",
    "params": {
     "hold": "20"
    }
   },
   "requires": {
    "pad": true
   },
   "estimatedSec": 15,
   "stimulus": "As the clear test, with the GamePad screen cleared to the inverse of each colour.",
   "expected": "Both screens fill with their own colour; neither screen shows the other's.",
   "checkpoints": [
    {
     "name": "clear_0",
     "capture": {
      "views": [
       "tv",
       "pad"
      ],
      "count": 1
     },
     "expect": [
      {
       "type": "mean_color",
       "name": "TV is red",
       "rgb": [
        255,
        0,
        0
       ],
       "tol": 6
      },
      {
       "type": "mean_color",
       "name": "GamePad is the inverse of red",
       "rgb": [
        0,
        255,
        255
       ],
       "tol": 6,
       "view": "pad"
      }
     ]
    },
    {
     "name": "clear_1",
     "capture": {
      "views": [
       "tv",
       "pad"
      ],
      "count": 1
     },
     "expect": [
      {
       "type": "mean_color",
       "name": "TV is green",
       "rgb": [
        0,
        255,
        0
       ],
       "tol": 6
      },
      {
       "type": "mean_color",
       "name": "GamePad is the inverse of green",
       "rgb": [
        255,
        0,
        255
       ],
       "tol": 6,
       "view": "pad"
      }
     ]
    },
    {
     "name": "clear_2",
     "capture": {
      "views": [
       "tv",
       "pad"
      ],
      "count": 1
     },
     "expect": [
      {
       "type": "mean_color",
       "name": "TV is blue",
       "rgb": [
        0,
        0,
        255
       ],
       "tol": 6
      },
      {
       "type": "mean_color",
       "name": "GamePad is the inverse of blue",
       "rgb": [
        255,
        255,
        0
       ],
       "tol": 6,
       "view": "pad"
      }
     ]
    },
    {
     "name": "clear_3",
     "capture": {
      "views": [
       "tv",
       "pad"
      ],
      "count": 1
     },
     "expect": [
      {
       "type": "mean_color",
       "name": "TV is white",
       "rgb": [
        255,
        255,
        255
       ],
       "tol": 6
      },
      {
       "type": "mean_color",
       "name": "GamePad is the inverse of white",
       "rgb": [
        0,
        0,
        0
       ],
       "tol": 6,
       "view": "pad"
      }
     ]
    },
    {
     "name": "clear_4",
     "capture": {
      "views": [
       "tv",
       "pad"
      ],
      "count": 1
     },
     "expect": [
      {
       "type": "mean_color",
       "name": "TV is black",
       "rgb": [
        0,
        0,
        0
       ],
       "tol": 6
      },
      {
       "type": "mean_color",
       "name": "GamePad is the inverse of black",
       "rgb": [
        255,
        255,
        255
       ],
       "tol": 6,
       "view": "pad"
      }
     ]
    },
    {
     "name": "clear_5",
     "capture": {
      "views": [
       "tv",
       "pad"
      ],
      "count": 1
     },
     "expect": [
      {
       "type": "mean_color",
       "name": "TV is grey",
       "rgb": [
        128,
        128,
        128
       ],
       "tol": 6
      },
      {
       "type": "mean_color",
       "name": "GamePad is the inverse of grey",
       "rgb": [
        127,
        127,
        127
       ],
       "tol": 6,
       "view": "pad"
      }
     ]
    },
    {
     "name": "clear_6",
     "capture": {
      "views": [
       "tv",
       "pad"
      ],
      "count": 1
     },
     "expect": [
      {
       "type": "mean_color",
       "name": "TV is steel",
       "rgb": [
        64,
        128,
        191
       ],
       "tol": 6
      },
      {
       "type": "mean_color",
       "name": "GamePad is the inverse of steel",
       "rgb": [
        191,
        127,
        64
       ],